{"schemaVersion":1,"id":"018f-example-event-001","scheduleDate":"2026-09-15","scheduledAt":"2026-09-15T09:15:30.123Z","answeredAt":"2026-09-15T09:17:02.456Z","mood":4,"energy":2,"focus":3,"stress":4,"additionalAnswers":{"calmness":5},"activity":"work_coding","activityLabel":"Work / coding","note":"Finishing a focused task","status":"answered","timezone":"Europe/Moscow"}
